{
  "acceptance_cases": [
    {
      "document": "docs/lead_factory_contract_v6/APP-LF-SOURCE-CRM.md",
      "evidence_refs": [],
      "execution_status": "SPECIFIED_NOT_IMPLEMENTED",
      "expected_result": "1 Company, 2 Deal.",
      "id": "AT-CRM-01",
      "line": 204,
      "owner_role": "ReleaseManager",
      "scenario": "Один DealerAccount, два distinct RFQ.",
      "test_bindings": []
    },
    {
      "document": "docs/lead_factory_contract_v6/APP-LF-SOURCE-CRM.md",
      "evidence_refs": [],
      "execution_status": "SPECIFIED_NOT_IMPLEMENTED",
      "expected_result": "Activity, не новый Lead.",
      "id": "AT-CRM-02",
      "line": 205,
      "owner_role": "ReleaseManager",
      "scenario": "Повторный ответ existing dealer.",
      "test_bindings": []
    },
    {
      "document": "docs/lead_factory_contract_v6/APP-LF-SOURCE-CRM.md",
      "evidence_refs": [],
      "execution_status": "SPECIFIED_NOT_IMPLEMENTED",
      "expected_result": "Ровно одна remote entity.",
      "id": "AT-CRM-03",
      "line": 206,
      "owner_role": "ReleaseManager",
      "scenario": "Retry/timeout одного write.",
      "test_bindings": []
    },
    {
      "document": "docs/lead_factory_contract_v6/APP-LF-SOURCE-CRM.md",
      "evidence_refs": [],
      "execution_status": "SPECIFIED_NOT_IMPLEMENTED",
      "expected_result": "Diagnostic conversion, не AGCO.",
      "id": "AT-CRM-04",
      "line": 207,
      "owner_role": "ReleaseManager",
      "scenario": "Form submit без outcome.",
      "test_bindings": []
    },
    {
      "document": "docs/lead_factory_contract_v6/APP-LF-SOURCE-CRM.md",
      "evidence_refs": [],
      "execution_status": "SPECIFIED_NOT_IMPLEMENTED",
      "expected_result": "Measurement gap; proof блокируется.",
      "id": "AT-CRM-05",
      "line": 208,
      "owner_role": "ReleaseManager",
      "scenario": "Payment без source/case linkage.",
      "test_bindings": []
    },
    {
      "document": "docs/lead_factory_contract_v6/APP-LF-SOURCE-CRM.md",
      "evidence_refs": [],
      "execution_status": "SPECIFIED_NOT_IMPLEMENTED",
      "expected_result": "Assignment/write блокируется.",
      "id": "AT-CRM-06",
      "line": 209,
      "owner_role": "ReleaseManager",
      "scenario": "Routed demand без capacity/consent permit.",
      "test_bindings": []
    },
    {
      "document": "docs/lead_factory_contract_v6/APP-LF-DEMAND-INTELLIGENCE.md",
      "evidence_refs": [],
      "execution_status": "SPECIFIED_NOT_IMPLEMENTED",
      "expected_result": "Typed extraction; 0 tool/policy/secret side effect.",
      "id": "AT-DI-01",
      "line": 375,
      "owner_role": "ModelRiskOwner",
      "scenario": "Страница содержит prompt injection.",
      "test_bindings": []
    },
    {
      "document": "docs/lead_factory_contract_v6/APP-LF-DEMAND-INTELLIGENCE.md",
      "evidence_refs": [],
      "execution_status": "SPECIFIED_NOT_IMPLEMENTED",
      "expected_result": "Один temporal object; все claims/evidence сохранены.",
      "id": "AT-DI-02",
      "line": 376,
      "owner_role": "ModelRiskOwner",
      "scenario": "Один объект в пяти sources/revisions.",
      "test_bindings": []
    },
    {
      "document": "docs/lead_factory_contract_v6/APP-LF-DEMAND-INTELLIGENCE.md",
      "evidence_refs": [],
      "execution_status": "SPECIFIED_NOT_IMPLEMENTED",
      "expected_result": "REVIEW, автоматического merge нет.",
      "id": "AT-DI-03",
      "line": 377,
      "owner_role": "ModelRiskOwner",
      "scenario": "Similar address/name без strong identity.",
      "test_bindings": []
    },
    {
      "document": "docs/lead_factory_contract_v6/APP-LF-DEMAND-INTELLIGENCE.md",
      "evidence_refs": [],
      "execution_status": "SPECIFIED_NOT_IMPLEMENTED",
      "expected_result": "Negative evidence блокирует ready.",
      "id": "AT-DI-04",
      "line": 378,
      "owner_role": "ModelRiskOwner",
      "scenario": "High positive score + supplier selected.",
      "test_bindings": []
    },
    {
      "document": "docs/lead_factory_contract_v6/APP-LF-DEMAND-INTELLIGENCE.md",
      "evidence_refs": [],
      "execution_status": "SPECIFIED_NOT_IMPLEMENTED",
      "expected_result": "Claim reject; graph/Gold не меняется.",
      "id": "AT-DI-05",
      "line": 379,
      "owner_role": "ModelRiskOwner",
      "scenario": "AI claim без exact evidence/hash/version.",
      "test_bindings": []
    },
    {
      "document": "docs/lead_factory_contract_v6/APP-LF-DEMAND-INTELLIGENCE.md",
      "evidence_refs": [],
      "execution_status": "SPECIFIED_NOT_IMPLEMENTED",
      "expected_result": "Adjudication/evidence task, не AGCO.",
      "id": "AT-DI-06",
      "line": 380,
      "owner_role": "ModelRiskOwner",
      "scenario": "Extractor и critic расходятся.",
      "test_bindings": []
    },
    {
      "document": "docs/lead_factory_contract_v6/APP-LF-DEMAND-INTELLIGENCE.md",
      "evidence_refs": [],
      "execution_status": "SPECIFIED_NOT_IMPLEMENTED",
      "expected_result": "0 read до scoped Source Permit.",
      "id": "AT-DI-07",
      "line": 381,
      "owner_role": "ModelRiskOwner",
      "scenario": "ИИ предложил web query.",
      "test_bindings": []
    },
    {
      "document": "docs/lead_factory_contract_v6/APP-LF-DEMAND-INTELLIGENCE.md",
      "evidence_refs": [],
      "execution_status": "SPECIFIED_NOT_IMPLEMENTED",
      "expected_result": "Point-in-time evaluator отклоняет dataset/model.",
      "id": "AT-DI-08",
      "line": 382,
      "owner_role": "ModelRiskOwner",
      "scenario": "Prediction использует future outcome feature.",
      "test_bindings": []
    },
    {
      "document": "docs/lead_factory_contract_v6/APP-LF-DEMAND-INTELLIGENCE.md",
      "evidence_refs": [],
      "execution_status": "SPECIFIED_NOT_IMPLEMENTED",
      "expected_result": "Promotion запрещён.",
      "id": "AT-DI-09",
      "line": 383,
      "owner_role": "ModelRiskOwner",
      "scenario": "Новая model лучше random split, хуже time holdout.",
      "test_bindings": []
    },
    {
      "document": "docs/lead_factory_contract_v6/APP-LF-DEMAND-INTELLIGENCE.md",
      "evidence_refs": [],
      "execution_status": "SPECIFIED_NOT_IMPLEMENTED",
      "expected_result": "Raw ingest сохранён; deterministic/manual degradation.",
      "id": "AT-DI-10",
      "line": 384,
      "owner_role": "ModelRiskOwner",
      "scenario": "AI provider недоступен.",
      "test_bindings": []
    },
    {
      "document": "docs/lead_factory_contract_v6/APP-LF-DEMAND-INTELLIGENCE.md",
      "evidence_refs": [],
      "execution_status": "SPECIFIED_NOT_IMPLEMENTED",
      "expected_result": "Один effect per model/schema/input hash.",
      "id": "AT-DI-11",
      "line": 385,
      "owner_role": "ModelRiskOwner",
      "scenario": "Повтор/retry AI job.",
      "test_bindings": []
    },
    {
      "document": "docs/lead_factory_contract_v6/APP-LF-DEMAND-INTELLIGENCE.md",
      "evidence_refs": [],
      "execution_status": "SPECIFIED_NOT_IMPLEMENTED",
      "expected_result": "Не выше SHADOW/REVISE.",
      "id": "AT-DI-12",
      "line": 386,
      "owner_role": "ModelRiskOwner",
      "scenario": "100+ shadow cases без significant commercial uplift.",
      "test_bindings": []
    },
    {
      "document": "docs/lead_factory_contract_v6/APP-LF-DEMAND-INTELLIGENCE.md",
      "evidence_refs": [],
      "execution_status": "SPECIFIED_NOT_IMPLEMENTED",
      "expected_result": "Commercial promotion запрещён.",
      "id": "AT-DI-13",
      "line": 387,
      "owner_role": "ModelRiskOwner",
      "scenario": "Model нашла больше records, но не AGCO/Paid.",
      "test_bindings": []
    },
    {
      "document": "docs/lead_factory_contract_v6/APP-LF-DEMAND-INTELLIGENCE.md",
      "evidence_refs": [],
      "execution_status": "SPECIFIED_NOT_IMPLEMENTED",
      "expected_result": "Claim отзывается/модель paused согласно threshold.",
      "id": "AT-DI-14",
      "line": 388,
      "owner_role": "ModelRiskOwner",
      "scenario": "Missed paid opportunity audit выявил drift.",
      "test_bindings": []
    },
    {
      "document": "docs/lead_factory_contract_v6/APP-LF-DEMAND-INTELLIGENCE.md",
      "evidence_refs": [],
      "execution_status": "SPECIFIED_NOT_IMPLEMENTED",
      "expected_result": "Ready/routing blocked, research/nurture допускается.",
      "id": "AT-DI-15",
      "line": 389,
      "owner_role": "ModelRiskOwner",
      "scenario": "Capacity равна нулю/устарела.",
      "test_bindings": []
    },
    {
      "document": "docs/lead_factory_contract_v6/APP-LF-DECISION-SCIENCE.md",
      "evidence_refs": [],
      "execution_status": "SPECIFIED_NOT_IMPLEMENTED",
      "expected_result": "Forecast shrinkage, не 100%.",
      "id": "AT-DS-01",
      "line": 308,
      "owner_role": "ModelRiskOwner",
      "scenario": "Малый segment 1/1 success.",
      "test_bindings": []
    },
    {
      "document": "docs/lead_factory_contract_v6/APP-LF-DECISION-SCIENCE.md",
      "evidence_refs": [],
      "execution_status": "SPECIFIED_NOT_IMPLEMENTED",
      "expected_result": "Model promotion denied.",
      "id": "AT-DS-02",
      "line": 309,
      "owner_role": "ModelRiskOwner",
      "scenario": "Random split хорош, time holdout плох.",
      "test_bindings": []
    },
    {
      "document": "docs/lead_factory_contract_v6/APP-LF-DECISION-SCIENCE.md",
      "evidence_refs": [],
      "execution_status": "SPECIFIED_NOT_IMPLEMENTED",
      "expected_result": "Dependency graph объединяет risk family.",
      "id": "AT-DS-03",
      "line": 310,
      "owner_role": "ModelRiskOwner",
      "scenario": "Search и Maps названы independent.",
      "test_bindings": []
    },
    {